{
  "descricao": "Catalogo de culturas do Anexo 2 do Manual RS/SC 2016 (p. 361-365): grupo de exigencia de fosforo (grupo_p, Tab. 6.2) e de potassio (grupo_k, Tab. 6.7) por cultura, com nome cientifico e sinonimos.",
  "versao": "1.0",
  "fonte": "Manual de Calagem e Adubacao para os Estados do Rio Grande do Sul e de Santa Catarina, 11. ed., 2016 - Anexo 2, p. 361-365",
  "procedencia": "Transcrito do Manual impresso por Igor Zanette em 2026-09-10; validado contra os cabecalhos das Tab. 6.2 e 6.7 (nenhuma cultura fora das listas nominais dos Grupos 1 e 4 recebe esses grupos) e conferido contra as transcricoes ja existentes em interpretacao_p.json, interpretacao_k.json e nos arquivos de adubacao por grupo: zero divergencias em 141 registros.",
  "o_que_o_anexo_2_nao_fornece": "O Anexo 2 da SOMENTE grupo_p e grupo_k. Nao da pH de referencia (fonte: ph_referencia.json, Tab. 5.1) nem criterio de calagem (fonte: mapa_culturas.json + criterios_calagem.json, Tab. 5.3 a 5.7). Nao acrescente esses campos aqui: duas fontes para a mesma pergunta e pior que uma incompleta.",
  "lacunas_conhecidas": [
    "abobrinha: consta da Tab. 5.1 (pH 6,0) mas NAO tem entrada no Anexo 2",
    "consorciacoes de gramineas e leguminosas (estacao fria e quente): a Tab. 5.1 as menciona; o Anexo 2 so lista especies individuais",
    "gramineas e leguminosas forrageiras de estacao fria e quente: idem"
  ],
  "culturas": {
    "abacateiro": {
      "nome_anexo2": "Abacateiro",
      "nome_exibicao": "Abacateiro",
      "sinonimos": [],
      "nome_cientifico": "Persea spp",
      "categoria": "frutiferas",
      "grupo_p": 2,
      "grupo_k": 2,
      "pagina": 364,
      "fonte_grupos": "Manual RS/SC 2016, Anexo 2, p. 364"
    },
    "abobora": {
      "nome_anexo2": "Abobora",
      "nome_exibicao": "Abobora",
      "sinonimos": [],
      "nome_cientifico": "Cucurbita moschata",
      "categoria": "hortalicas",
      "grupo_p": 2,
      "grupo_k": 2,
      "pagina": 363,
      "fonte_grupos": "Manual RS/SC 2016, Anexo 2, p. 363"
    },
    "acacia_negra": {
      "nome_anexo2": "Acacia-negra",
      "nome_exibicao": "Acacia-negra",
      "sinonimos": [],
      "nome_cientifico": "Acacia mearnsii",
      "categoria": "florestais",
      "grupo_p": 3,
      "grupo_k": 3,
      "pagina": 364,
      "fonte_grupos": "Manual RS/SC 2016, Anexo 2, p. 364"
    },
    "alcachofra": {
      "nome_anexo2": "Alcachofra",
      "nome_exibicao": "Alcachofra",
      "sinonimos": [],
      "nome_cientifico": "Cynara scolymus",
      "categoria": "hortalicas",
      "grupo_p": 2,
      "grupo_k": 2,
      "pagina": 363,
      "fonte_grupos": "Manual RS/SC 2016, Anexo 2, p. 363"
    },
    "alface": {
      "nome_anexo2": "Alface",
      "nome_exibicao": "Alface",
      "sinonimos": [],
      "nome_cientifico": "Lactuca sativa",
      "categoria": "hortalicas",
      "grupo_p": 2,
      "grupo_k": 2,
      "pagina": 363,
      "fonte_grupos": "Manual RS/SC 2016, Anexo 2, p. 363"
    },
    "alfafa": {
      "nome_anexo2": "Alfafa",
      "nome_exibicao": "Alfafa",
      "sinonimos": [],
      "nome_cientifico": "Medicago sativa",
      "categoria": "forrageiras",
      "grupo_p": 2,
      "grupo_k": 2,
      "pagina": 362,
      "fonte_grupos": "Manual RS/SC 2016, Anexo 2, p. 362"
    },
    "alfavaca": {
      "nome_anexo2": "Alfavaca (manjericao)",
      "nome_exibicao": "Alfavaca",
      "sinonimos": [
        "manjericao"
      ],
      "nome_cientifico": "Ocimum basilicum",
      "categoria": "medicinais_aromaticas_condimentares",
      "grupo_p": 3,
      "grupo_k": 3,
      "pagina": 364,
      "fonte_grupos": "Manual RS/SC 2016, Anexo 2, p. 364"
    },
    "alho": {
      "nome_anexo2": "Alho",
      "nome_exibicao": "Alho",
      "sinonimos": [],
      "nome_cientifico": "Allium sativum",
      "categoria": "hortalicas",
      "grupo_p": 1,
      "grupo_k": 1,
      "pagina": 363,
      "fonte_grupos": "Manual RS/SC 2016, Anexo 2, p. 363"
    },
    "ameixeira": {
      "nome_anexo2": "Ameixeira",
      "nome_exibicao": "Ameixeira",
      "sinonimos": [],
      "nome_cientifico": "Prunus domestica, P. salicina",
      "categoria": "frutiferas",
      "grupo_p": 2,
      "grupo_k": 2,
      "pagina": 364,
      "fonte_grupos": "Manual RS/SC 2016, Anexo 2, p. 364"
    },
    "amendoim": {
      "nome_anexo2": "Amendoim",
      "nome_exibicao": "Amendoim",
      "sinonimos": [],
      "nome_cientifico": "Arachis hypogaea",
      "categoria": "graos",
      "grupo_p": 2,
      "grupo_k": 2,
      "pagina": 361,
      "fonte_grupos": "Manual RS/SC 2016, Anexo 2, p. 361"
    },
    "amendoim_forrageiro": {
      "nome_anexo2": "Amendoim forrageiro",
      "nome_exibicao": "Amendoim forrageiro",
      "sinonimos": [],
      "nome_cientifico": "Arachis pintoi",
      "categoria": "forrageiras",
      "grupo_p": 2,
      "grupo_k": 2,
      "pagina": 362,
      "fonte_grupos": "Manual RS/SC 2016, Anexo 2, p. 362"
    },
    "amoreira_preta": {
      "nome_anexo2": "Amoreira-preta",
      "nome_exibicao": "Amoreira-preta",
      "sinonimos": [],
      "nome_cientifico": "Rubus spp",
      "categoria": "frutiferas",
      "grupo_p": 2,
      "grupo_k": 2,
      "pagina": 364,
      "fonte_grupos": "Manual RS/SC 2016, Anexo 2, p. 364"
    },
    "araucaria": {
      "nome_anexo2": "Araucaria (pinheiro brasileiro)",
      "nome_exibicao": "Araucaria",
      "sinonimos": [
        "pinheiro brasileiro"
      ],
      "nome_cientifico": "Araucaria angustifolia",
      "categoria": "florestais",
      "grupo_p": 3,
      "grupo_k": 3,
      "pagina": 364,
      "fonte_grupos": "Manual RS/SC 2016, Anexo 2, p. 364"
    },
    "arroz": {
      "nome_anexo2": "Arroz",
      "nome_exibicao": "Arroz",
      "sinonimos": [],
      "nome_cientifico": "Oryza sativa",
      "categoria": "graos",
      "grupo_p": 2,
      "grupo_k": 2,
      "pagina": 361,
      "fonte_grupos": "Manual RS/SC 2016, Anexo 2, p. 361"
    },
    "arroz_irrigado": {
      "nome_anexo2": "Arroz irrigado",
      "nome_exibicao": "Arroz irrigado",
      "sinonimos": [],
      "nome_cientifico": "Oryza sativa",
      "categoria": "graos",
      "grupo_p": 4,
      "grupo_k": 2,
      "pagina": 361,
      "fonte_grupos": "Manual RS/SC 2016, Anexo 2, p. 361"
    },
    "aspargo": {
      "nome_anexo2": "Aspargo",
      "nome_exibicao": "Aspargo",
      "sinonimos": [],
      "nome_cientifico": "Asparagus officinalis",
      "categoria": "hortalicas",
      "grupo_p": 2,
      "grupo_k": 2,
      "pagina": 363,
      "fonte_grupos": "Manual RS/SC 2016, Anexo 2, p. 363"
    },
    "aveia_branca": {
      "nome_anexo2": "Aveia branca",
      "nome_exibicao": "Aveia branca",
      "sinonimos": [],
      "nome_cientifico": "Avena sativa",
      "categoria": "graos",
      "grupo_p": 2,
      "grupo_k": 2,
      "pagina": 361,
      "fonte_grupos": "Manual RS/SC 2016, Anexo 2, p. 361"
    },
    "aveia_perene": {
      "nome_anexo2": "Aveia perene",
      "nome_exibicao": "Aveia perene",
      "sinonimos": [],
      "nome_cientifico": "Arrhenatherum elatius",
      "categoria": "forrageiras",
      "grupo_p": 2,
      "grupo_k": 2,
      "pagina": 362,
      "fonte_grupos": "Manual RS/SC 2016, Anexo 2, p. 362"
    },
    "aveia_preta": {
      "nome_anexo2": "Aveia preta",
      "nome_exibicao": "Aveia preta",
      "sinonimos": [],
      "nome_cientifico": "Avena strigosa",
      "categoria": "graos",
      "grupo_p": 2,
      "grupo_k": 2,
      "pagina": 361,
      "fonte_grupos": "Manual RS/SC 2016, Anexo 2, p. 361"
    },
    "aveias": {
      "nome_anexo2": "Aveias",
      "nome_exibicao": "Aveias",
      "sinonimos": [],
      "nome_cientifico": "Avena spp",
      "categoria": "forrageiras",
      "grupo_p": 2,
      "grupo_k": 2,
      "pagina": 362,
      "fonte_grupos": "Manual RS/SC 2016, Anexo 2, p. 362"
    },
    "azevem": {
      "nome_anexo2": "Azevem",
      "nome_exibicao": "Azevem",
      "sinonimos": [],
      "nome_cientifico": "Lolium multiflorum, L. perenne",
      "categoria": "forrageiras",
      "grupo_p": 2,
      "grupo_k": 2,
      "pagina": 362,
      "fonte_grupos": "Manual RS/SC 2016, Anexo 2, p. 362"
    },
    "bananeira": {
      "nome_anexo2": "Bananeira",
      "nome_exibicao": "Bananeira",
      "sinonimos": [],
      "nome_cientifico": "Musa spp",
      "categoria": "frutiferas",
      "grupo_p": 2,
      "grupo_k": 2,
      "pagina": 364,
      "fonte_grupos": "Manual RS/SC 2016, Anexo 2, p. 364"
    },
    "batata": {
      "nome_anexo2": "Batata",
      "nome_exibicao": "Batata",
      "sinonimos": [],
      "nome_cientifico": "Solanum tuberosum",
      "categoria": "tuberculos_e_raizes",
      "grupo_p": 1,
      "grupo_k": 1,
      "pagina": 363,
      "fonte_grupos": "Manual RS/SC 2016, Anexo 2, p. 363"
    },
    "batata_doce": {
      "nome_anexo2": "Batata-doce",
      "nome_exibicao": "Batata-doce",
      "sinonimos": [],
      "nome_cientifico": "Ipomoea batatas",
      "categoria": "tuberculos_e_raizes",
      "grupo_p": 3,
      "grupo_k": 1,
      "pagina": 363,
      "fonte_grupos": "Manual RS/SC 2016, Anexo 2, p. 363"
    },
    "beringela": {
      "nome_anexo2": "Beringela",
      "nome_exibicao": "Beringela",
      "sinonimos": [],
      "nome_cientifico": "Solanum melongena",
      "categoria": "hortalicas",
      "grupo_p": 2,
      "grupo_k": 2,
      "pagina": 363,
      "fonte_grupos": "Manual RS/SC 2016, Anexo 2, p. 363"
    },
    "beterraba": {
      "nome_anexo2": "Beterraba",
      "nome_exibicao": "Beterraba",
      "sinonimos": [],
      "nome_cientifico": "Beta vulgaris",
      "categoria": "hortalicas",
      "grupo_p": 1,
      "grupo_k": 1,
      "pagina": 363,
      "fonte_grupos": "Manual RS/SC 2016, Anexo 2, p. 363"
    },
    "bracatinga": {
      "nome_anexo2": "Bracatinga",
      "nome_exibicao": "Bracatinga",
      "sinonimos": [],
      "nome_cientifico": "Mimosa scabrella",
      "categoria": "florestais",
      "grupo_p": 3,